{
  "current_phase": 7,
  "current_spec": 29,
  "test_count": 354,
  "last_commit": "",
  "accumulated_context": {
    "decisions": [
      "Project blocks live in .workflow/ \u2014 the project artifact directory",
      "Specs 26-29 form Phase 7: project structure, execution primitives, verification",
      "forEach when: conditional applies globally (before iteration starts), not per-iteration \u2014 per-iteration conditions require when to be expressible without forEach-scoped variables at the top level",
      "command step fails on non-zero exit (unlike gate which always returns completed with passed: true/false)"
    ],
    "todos": [
      "Spec 29: Self-implementing workflow demo",
      "Delete old .md demo agents (demo proved out with .agent.yaml)",
      "Remove dead code: writeStepOutput in state.ts"
    ],
    "issues": [
      {
        "severity": "low",
        "description": "Expression parser has known limitation with adjacent ${{ }}${{ }} expressions in a single string \u2014 whole-value regex can misparse them. Pre-existing, not introduced by spec 27."
      }
    ],
    "blockers": []
  },
  "session": {
    "last_action": "Completed spec 28: verifier-output schema, verifier agent spec, plan-breakdown and execution-results schemas (354 tests)",
    "next_action": "Implement spec 29: self-implementing workflow demo"
  }
}
